{
  "id": "codex-cli-windows-0.162.0-alpha.20",
  "kind": "command",
  "sandboxed": false,
  "workspace_isolation": "process",
  "capabilities": [
    "skill_injection"
  ],
  "adapter_runtime_files": [
    "codex_cli.py",
    "diagnostics.py"
  ],
  "command": [
    "{python}",
    "{skill_path}/../qualification/adapters/codex_cli.py",
    "run",
    "{workspace}",
    "{task_file}",
    "{condition_file}",
    "{output_file}",
    "{phase}",
    "gpt-6-luna",
    "{skill_path}"
  ],
  "skill_install_command": [
    "{python}",
    "{skill_path}/../qualification/adapters/codex_cli.py",
    "install",
    "{workspace}",
    "{skill_path}"
  ],
  "environment_passthrough": [
    "ALL_PROXY",
    "APPDATA",
    "CODEX_CLI_PATH",
    "CODEX_HOME",
    "CODEX_WINDOWS_SANDBOX_PACKAGE_FAMILY",
    "COMSPEC",
    "HOMEDRIVE",
    "HOMEPATH",
    "HTTPS_PROXY",
    "HTTP_PROXY",
    "LOCALAPPDATA",
    "NO_PROXY",
    "PROGRAMDATA",
    "SYSTEMROOT",
    "TEMP",
    "TMP",
    "USERPROFILE",
    "WINDIR",
    "WS_PROXY",
    "WSS_PROXY"
  ],
  "timeout_seconds": 900,
  "agent": {
    "family": "codex",
    "model_id": "gpt-6-luna",
    "scaffold_version": "codex-cli-0.162.0-alpha.20"
  },
  "host_tool": {
    "name": "Codex CLI",
    "version": "0.162.0-alpha.20"
  }
}
